video_id,title,published_at
mzxJ0bA-Co8,Quickest v slowest cars of every brand RANKED!,2025-06-02 10:05:48+00:00
12g1g_4hUQM,Guess the car! 🚗,2025-05-31 18:04:00+00:00
hHjEtAKvWC4,"Ferrari SF90 v 1,000hp Golf R & BMW M240i: DRAG RACE",2025-05-31 08:04:00+00:00
4So81kN3p6A,This car has SO many cameras! 📸📸📸,2025-05-30 18:04:00+00:00
kECvvxj5OOQ,The new BMW M2 CS got us like 😍🥵🚨,2025-05-29 18:04:00+00:00
ytSzn1TMviY,Is this Honda pretending to be a BMW?!,2025-05-28 18:04:01+00:00
6vfjPMVMk0U,New BMW M2 CS & the BEST new cars coming 2025 - 2027!,2025-05-28 07:07:04+00:00
_Vy54pWu-yU,Out of context Carwow...,2025-05-27 18:04:00+00:00
bzKg1yoksrM,Porsche 911 Hybrid v BMW M8 Comp: DRAG RACE,2025-05-26 14:22:19+00:00
Ky_l9FxSHOs,911 GT3 RS v AMG GT R: DRAG RACE,2025-05-24 08:04:00+00:00
YAD5dVEgoPM,"Chat, is this real?!",2025-05-22 18:04:00+00:00
LuBHJkVf-xQ,Has Volvo finally nailed it?,2025-05-22 13:04:00+00:00
5L4MICCvMiw,New Nissan Micra revealed!,2025-05-21 09:04:00+00:00
oxz5AkRT5Cs,Every Ariel Atom DRAG RACE,2025-05-20 10:04:25+00:00
svd8zDPeOo4,This van can weigh itself! 😱,2025-05-19 18:04:00+00:00
9qCIAeAfcuE,New Skoda Elroq Review,2025-05-19 14:18:19+00:00
2ZZ9juClZqc,"1,020hp M5 vs 1,000hp SF90 DRAG RACE! 🔥",2025-05-17 18:04:00+00:00
NWXplOe1Su0,Ford F-150 Raptor R v AMG G63: DRAG RACE,2025-05-17 08:04:01+00:00
FoUZ-gAtwak,Lexus LX600 vs Nissan Patrol brake test!,2025-05-16 18:04:00+00:00
1khDVVJODDM,Why the new Porsche Panamera is ALMOST perfect!,2025-05-15 12:10:51+00:00
